telas,processadores,armazenamentos,rams,placas de vídeo,teclados,slots de memória,sistemas operacionais,cores,placas mãe
ASUS ROG Swift PG279QZ,Intel Core i9-12900K,Samsung 980 PRO NVMe SSD,G.Skill Ripjaws V DDR4 3600MHz,Nvidia GeForce RTX 3090,Corsair K100 RGB,Corsair Dominator Platinum RGB DDR4 4000MHz,Windows 11 Pro,Preto,ASUS ROG Maximus XV Extreme
Acer Predator X27,AMD Ryzen 9 5950X,Samsung 970 EVO Plus NVMe SSD,Corsair Vengeance RGB Pro DDR4 3200MHz,Nvidia GeForce RTX 3080 Ti,Logitech G915 TKL,G.Skill Trident Z Neo DDR4 3600MHz,Windows 10 Pro,Vermelho,ASUS ROG Strix X570-E Gaming
Alienware 34 Curved Gaming Monitor,Intel Core i7-11900K,Western Digital Black SN850 NVMe SSD,HyperX Fury RGB DDR4 3200MHz,AMD Radeon RX 6900 XT,Razer Huntsman Mini,Corsair Vengeance LPX DDR4 3200MHz,Windows 11 Home,Branco,Gigabyte AORUS X570 Master
LG 27GP950-B,AMD Ryzen 7 5800X,Seagate FireCuda 520 NVMe SSD,Crucial Ballistix RGB DDR4 3200MHz,Nvidia GeForce RTX 3070 Ti,SteelSeries Apex Pro,Kingston HyperX Predator DDR4 3200MHz,Windows 10 Home,Cinza,ASRock X570 Taichi
ViewSonic Elite XG270QG,Intel Core i5-12600K,ADATA XPG Gammix S70 NVMe SSD,Patriot Viper Steel DDR4 3200MHz,AMD Radeon RX 6800 XT,HyperX Alloy FPS Pro,Corsair Vengeance LPX DDR4 3200MHz,Ubuntu 20.04 LTS,Azul,MSI MPG B550 Gaming Edge WiFi
HP Omen X 27,AMD Ryzen 5 5600X,Sabrent Rocket 4.0 NVMe SSD,Team T-Force Delta RGB DDR4 3200MHz,Nvidia GeForce RTX 3060 Ti,Logitech G213 Prodigy,ADATA XPG Spectrix D50 DDR4 3600MHz,Windows 11 Home,Verde,ASUS ROG Crosshair VIII Hero
Dell Alienware AW3418DW,Intel Core i9-11900KF,Crucial P5 Plus NVMe SSD,Corsair Dominator Platinum RGB DDR4 3200MHz,AMD Radeon RX 6700 XT,Corsair K70 RGB MK.2,G.Skill Ripjaws V DDR4 3200MHz,Windows 10 Pro for Workstations,Rosa,Gigabyte X570 AORUS Master
